{
  "worker": "WIKI-162-REVIEW1",
  "sha": "0123456",
  "state": "MERGE-READY",
  "findings": [
    {
      "id": "F-a1b2c3",
      "severity": "HIGH",
      "title": "the edge accepts an incomplete payload",
      "observed": "a required field is not checked",
      "why_wrong": "the graph can contain an action that cannot be replayed",
      "do_instead": "validate the per-kind payload before appending the edge",
      "source_worker": "WIKI-162-REVIEW1",
      "source_sha": "0123456",
      "created_at": "2026-07-22T18:00:00Z"
    }
  ],
  "summary": "reviewed the graph contracts",
  "created_at": "2026-07-22T18:00:00Z"
}
